Sheet: Revue D'Histoire et de Critique
A1: Title | B1: Année | C1: No. | D1: Secondary Title | E1: Call Number | F1: Date | G1: Extent | H1: Actual Page Count | I1: Bound? | J1: Covers? | K1: Notes
A2: Revue d'Histoire et de Critique Musicales | B2: 1 | C2: 1 | D2: Publication mensuelle principalement consacrée à la musique française ancienne et moderne | E2: ML5.R35 | F2: Janvier 1901 | G2: vi-vii; 2-32 | H2: 37 | I2: yes | J2: no | K2: page count includes title page / table of contents for first issues per volume; continuous pagination
A3: Revue d'Histoire et de Critique Musicales | B3: 1 | C3: 2 | D3: Publication mensuelle principalement consacrée à la musique française ancienne et moderne | E3: ML5.R35 | F3: Février 1901 | G3: 33-80 | H3: 48 | I3: yes | J3: no
A4: Revue d'Histoire et de Critique Musicales | B4: 1 | C4: 3 | D4: Publication mensuelle principalement consacrée à la musique française ancienne et moderne | E4: ML5.R35 | F4: Mars 1901 | G4: 81-128 | H4: 48 | I4: yes | J4: no
A5: Revue d'Histoire et de Critique Musicales | B5: 1 | C5: 4 | D5: Publication mensuelle principalement consacrée à la musique française ancienne et moderne | E5: ML5.R35 | F5: Avril 1901 | G5: 129-176 | H5: 48 | I5: yes | J5: no
A6: Revue d'Histoire et de Critique Musicales | B6: 1 | C6: 5 | D6: Publication mensuelle principalement consacrée à la musique française ancienne et moderne | E6: ML5.R35 | F6: Mai 1901 | G6: 177-224 | H6: 50 | I6: yes | J6: no | K6: image insert after pg, 212
A7: Revue d'Histoire et de Critique Musicales | B7: 1 | C7: 6 | D7: Publication mensuelle principalement consacrée à la musique française ancienne et moderne | E7: ML5.R35 | F7: Juin 1901 | G7: 225-272 | H7: 48 | I7: yes | J7: no
A8: Revue d'Histoire et de Critique Musicales | B8: 1 | C8: 7 | D8: Publication mensuelle principalement consacrée à la musique française ancienne et moderne | E8: ML5.R35 | F8: Juillet 1901 | G8: 273-304 | H8: 32 | I8: yes | J8: no
A9: Revue d'Histoire et de Critique Musicales | B9: 1 | C9: 8 | D9: Publication mensuelle principalement consacrée à la musique française ancienne et moderne | E9: ML5.R35 | F9: Août-Septembre 1901 | G9: 305-352 | H9: 48 | I9: yes | J9: no
A10: Revue d'Histoire et de Critique Musicales | B10: 1 | C10: 9 | D10: Publication mensuelle principalement consacrée à la musique française ancienne et moderne | E10: ML5.R35 | F10: Octobre 1901 | G10: 353-384 | H10: 32 | I10: yes | J10: no
A11: Revue d'Histoire et de Critique Musicales | B11: 1 | C11: 10 | D11: Publication mensuelle principalement consacrée à la musique française ancienne et moderne | E11: ML5.R35 | F11: Novembre 1901 | G11: 385-424 | H11: 40 | I11: yes | J11: no
A12: Revue d'Histoire et de Critique Musicales | B12: 1 | C12: 11 - 12 | D12: Publication mensuelle principalement consacrée à la musique française ancienne et moderne | E12: ML5.R35 | F12: Décembre 1901 | G12: 425-476 | H12: 52 | I12: yes | J12: no
G13: TOTAL PAGE COUNT: | H13: =SUM(R[-11]C:R[-1]C) -> 435
A14: La revue musicale | B14: 2 | C14: 1 | D14: Revue d'Histoire et de Critique, Publication mensuelle Honorée d'une souscription du Ministère de l'Instruction publique | E14: ML5.R35 | F14: Janvier 1902 | G14: vi-vii; 1-56 | H14: 64 | I14: yes | J14: no | K14: page count includes les offrandes musicales; table alphabétique; table méthodique
A15: La revue musicale | B15: 2 | C15: 2 | D15: Revue d'Histoire et de Critique, Publication mensuelle Honorée d'une souscription du Ministère de l'Instruction publique | E15: ML5.R35 | F15: Février 1902 | G15: 57-96 | H15: 40 | I15: yes | J15: no
A16: La revue musicale | B16: 2 | C16: 3 | D16: Revue d'Histoire et de Critique, Publication mensuelle Honorée d'une souscription du Ministère de l'Instruction publique | E16: ML5.R35 | F16: Mars 1902 | G16: 97-136 | H16: 40 | I16: yes | J16: no
A17: La revue musicale | B17: 2 | C17: 4 | D17: Revue d'Histoire et de Critique, Publication mensuelle Honorée d'une souscription du Ministère de l'Instruction publique | E17: ML5.R35 | F17: Avril 1902 | G17: 137-192 | H17: 56 | I17: yes | J17: no
A18: La revue musicale | B18: 2 | C18: 5 | D18: Revue d'Histoire et de Critique, Publication mensuelle Honorée d'une souscription du Ministère de l'Instruction publique | E18: ML5.R35 | F18: Mai 1902 | G18: 193-240 | H18: 48 | I18: yes | J18: no
A19: La revue musicale | B19: 2 | C19: 6 | D19: Revue d'Histoire et de Critique, Publication mensuelle Honorée d'une souscription du Ministère de l'Instruction publique | E19: ML5.R35 | F19: Juin 1902 | G19: 241-288 | H19: 48 | I19: yes | J19: no
A20: La revue musicale | B20: 2 | C20: 7 | D20: Revue d'Histoire et de Critique, Publication mensuelle Honorée d'une souscription du Ministère de l'Instruction publique | E20: ML5.R35 | F20: Juillet 1902 | G20: 289-336 | H20: 48 | I20: yes | J20: no
A21: La revue musicale | B21: 2 | C21: 8 | D21: Revue d'Histoire et de Critique, Publication mensuelle Honorée d'une souscription du Ministère de l'Instruction publique | E21: ML5.R35 | F21: Août 1902 | G21: 337-368 | H21: 32 | I21: yes | J21: no
A22: La revue musicale | B22: 2 | C22: 9 | D22: Revue d'Histoire et de Critique, Publication mensuelle Honorée d'une souscription du Ministère de l'Instruction publique | E22: ML5.R35 | F22: Septembre 1902 | G22: 369-400 | H22: 32 | I22: yes | J22: no
A23: La revue musicale | B23: 2 | C23: 10 | D23: Revue d'Histoire et de Critique, Publication mensuelle Honorée d'une souscription du Ministère de l'Instruction publique | E23: ML5.R35 | F23: Octobre 1902 | G23: 401-448 | H23: 48 | I23: yes | J23: no
A24: La revue musicale | B24: 2 | C24: 11 | D24: Revue d'Histoire et de Critique, Publication mensuelle Honorée d'une souscription du Ministère de l'Instruction publique | E24: ML5.R35 | F24: Novembre 1902 | G24: 449-496 | H24: 48 | I24: yes | J24: no
A25: La revue musicale | B25: 2 | C25: 12 | D25: Revue d'Histoire et de Critique, Publication mensuelle Honorée d'une souscription du Ministère de l'Instruction publique | E25: ML5.R35 | F25: Décembre 1902 | G25: 497-544 | H25: 48 | I25: yes | J25: no
G26: TOTAL PAGE COUNT: | H26: =SUM(R[-12]C:R[-1]C) -> 552
A27: La revue musicale | B27: 3 | C27: 1 | D27: Publication bi-mensuelle Honorée d'une souscription du Ministère de l'Instruction publique et des Beaux-Arts | E27: ML5.R35 | F27: Janvier 1903 | G27: vi-xi; 1-64 | H27: 71 | I27: yes | J27: no
A28: La revue musicale | B28: 3 | C28: 2 | D28: Publication bi-mensuelle Honorée d'une souscription du Ministère de l'Instruction publique et des Beaux-Arts | E28: ML5.R35 | F28: Février 1903 | G28: 5-112 | H28: 47 | I28: yes | J28: no
A29: La revue musicale | B29: 3 | C29: 3 | D29: Publication bi-mensuelle Honorée d'une souscription du Ministère de l'Instruction publique et des Beaux-Arts | E29: ML5.R35 | F29: Mars 1903 | G29: 113-160 | H29: 47 | I29: yes | J29: no
A30: La revue musicale | B30: 3 | C30: 4 | D30: Publication bi-mensuelle Honorée d'une souscription du Ministère de l'Instruction publique et des Beaux-Arts | E30: ML5.R35 | F30: Avril 1903 | G30: 161-208 | H30: 47 | I30: yes | J30: no
A31: La revue musicale | B31: 3 | C31: 5 | D31: Publication bi-mensuelle Honorée d'une souscription du Ministère de l'Instruction publique et des Beaux-Arts | E31: ML5.R35 | F31: 31 Mai-1er Juin 1903 | G31: 209-256 | H31: 45 | I31: yes | J31: no
A32: La revue musicale | B32: 3 | C32: 6 | D32: Publication bi-mensuelle Honorée d'une souscription du Ministère de l'Instruction publique et des Beaux-Arts | E32: ML5.R35 | F32: 15 Juin 1903 | G32: 257-288 | H32: 32 | I32: yes | J32: no
A33: La revue musicale | B33: 3 | C33: 7 | D33: Publication bi-mensuelle Honorée d'une souscription du Ministère de l'Instruction publique et des Beaux-Arts | E33: ML5.R35 | F33: 1er Juillet 1903 | G33: 289-312 | H33: 24 | I33: yes | J33: no
A34: La revue musicale | B34: 3 | C34: 8 | D34: Publication bi-mensuelle Honorée d'une souscription du Ministère de l'Instruction publique et des Beaux-Arts | E34: ML5.R35 | F34: 15 Juillet 1903 | G34: 313-352 | H34: 40 | I34: yes | J34: no
A35: La revue musicale | B35: 3 | C35: 9 | D35: Publication bi-mensuelle Honorée d'une souscription du Ministère de l'Instruction publique et des Beaux-Arts | E35: ML5.R35 | F35: 1er Août 1903 | G35: 353-400 | H35: 45 | I35: yes | J35: no
A36: La revue musicale | B36: 3 | C36: 10 | D36: Publication bi-mensuelle Honorée d'une souscription du Ministère de l'Instruction publique et des Beaux-Arts | E36: ML5.R35 | F36: 15 Août 1903 | G36: 401-448 | H36: 46 | I36: yes | J36: no
A37: La revue musicale | B37: 3 | C37: 11 | D37: Publication bi-mensuelle Honorée d'une souscription du Ministère de l'Instruction publique et des Beaux-Arts | E37: ML5.R35 | F37: 1er Septembre 1903 | G37: 449-496 | H37: 47 | I37: yes | J37: no
A38: La revue musicale | B38: 3 | C38: 12 | D38: Publication bi-mensuelle Honorée d'une souscription du Ministère de l'Instruction publique et des Beaux-Arts | E38: ML5.R35 | F38: 15 Septembre 1903 | G38: 497-520 [536] | H38: 40 | I38: yes | J38: no | K38: *Issue bound out of order. Pgs. 497-512; 521-536; 513-520;
A39: La revue musicale | B39: 3 | C39: 13 | D39: Publication bi-mensuelle Honorée d'une souscription du Ministère de l'Instruction publique et des Beaux-Arts | E39: ML5.R35 | F39: 1er Octobre 1903 | G39: 537-560 | H39: 24 | I39: yes | J39: no
A40: La revue musicale | B40: 3 | C40: 14 | D40: Publication bi-mensuelle Honorée d'une souscription du Ministère de l'Instruction publique et des Beaux-Arts | E40: ML5.R35 | F40: 15 Octobre 1903 | G40: 561-588 | H40: 28 | I40: yes | J40: no | K40: Pages 581-584 loose/poor condition
A41: La revue musicale | B41: 3 | C41: 15 | D41: Publication bi-mensuelle Honorée d'une souscription du Ministère de l'Instruction publique et des Beaux-Arts | E41: ML5.R35 | F41: 1er Novembre 1903 | G41: 589-620 | H41: 32 | I41: yes | J41: no
A42: La revue musicale | B42: 3 | C42: 16 | D42: Publication bi-mensuelle Honorée d'une souscription du Ministère de l'Instruction publique et des Beaux-Arts | E42: ML5.R35 | F42: 15 Novembre 1903 | G42: 621-652 | H42: 32 | I42: yes | J42: no
A43: La revue musicale | B43: 3 | C43: 17 | D43: Publication bi-mensuelle Honorée d'une souscription du Ministère de l'Instruction publique et des Beaux-Arts | E43: ML5.R35 | F43: 1er Décembre 1903 | G43: 653-692 | H43: 40 | I43: yes | J43: no
A44: La revue musicale | B44: 3 | C44: 18 | D44: Publication bi-mensuelle Honorée d'une souscription du Ministère de l'Instruction publique et des Beaux-Arts | E44: ML5.R35 | F44: 15 Décembre 1903 | G44: 693-732 | H44: 40 | I44: yes | J44: no
A45: La revue musicale | B45: 3 | C45: Supplément | D45: Anthologie de la "Revue Musicale" | E45: ML5.R35 | F45: Supplément de la "Revue Musicale" | G45: 1-16 | H45: 16 | I45: yes | J45: no
A46: La revue musicale | B46: 3 | C46: Supplément | D46: Anthologie de la "Revue Musicale" | E46: ML5.R35 | F46: Supplément de la "Revue Musicale" du 1er Juillet 1903 | G46: 17-24 | H46: 8 | I46: yes | J46: no
A47: La revue musicale | B47: 3 | C47: Supplément | D47: Anthologie de la "Revue Musicale" | E47: ML5.R35 | F47: Supplément de la "Revue Musicale" du 15 Juillet 1903 | G47: 25-32 | H47: 8 | I47: yes | J47: no
A48: La revue musicale | B48: 3 | C48: Supplément | D48: Anthologie de la "Revue Musicale" | E48: ML5.R35 | F48: Supplément de la "Revue Musicale" du 1er Août 1903 | G48: 33-40 | H48: 8 | I48: yes | J48: no
A49: La revue musicale | B49: 3 | C49: Supplément | D49: Anthologie de la "Revue Musicale" | E49: ML5.R35 | F49: Supplément de la "Revue Musicale" du 15 Août 1903 | G49: 41-48 | H49: 8 | I49: yes | J49: no
A50: La revue musicale | B50: 3 | C50: Supplément | D50: Anthologie de la "Revue Musicale" | E50: ML5.R35 | F50: Supplément de la "Revue Musicale" du 1er Septembre 1903 | G50: 49-56 | H50: 8 | I50: yes | J50: no
A51: La revue musicale | B51: 3 | C51: Supplément | D51: Anthologie de la "Revue Musicale" | E51: ML5.R35 | F51: Supplément de la "Revue Musicale" du 15 Septembre 1903 | G51: 57-64 | H51: 8 | I51: yes | J51: no | K51: [includes 15 Octobre 1903?]
A52: La revue musicale | B52: 3 | C52: Supplément | D52: Anthologie de la "Revue Musicale" | E52: ML5.R35 | F52: Supplément de la "Revue Musicale" du 1er Octobre 1903 | G52: 65-80 | H52: 16 | I52: yes | J52: no
A53: La revue musicale | B53: 3 | C53: Supplément | D53: Anthologie de la "Revue Musicale" | E53: ML5.R35 | F53: Supplément de la "Revue Musicale" du 1er Novembre 1903 | G53: 73-84 | H53: 12 | I53: yes | J53: no
A54: La revue musicale | B54: 3 | C54: Supplément | D54: Anthologie de la "Revue Musicale" | E54: ML5.R35 | F54: Supplément de la "Revue Musicale" du 15 Novembre 1903 | G54: 85-88 | H54: 4 | I54: yes | J54: no
A55: La revue musicale | B55: 3 | C55: Supplément | D55: Anthologie de la "Revue Musicale" | E55: ML5.R35 | F55: Supplément de la "Revue Musicale" du 1er Décembre 1903 | G55: 89-96 | H55: 8 | I55: yes | J55: no
A56: La revue musicale | B56: 3 | C56: Supplément | D56: Anthologie de la "Revue Musicale" | E56: ML5.R35 | F56: Supplément de la "Revue Musicale" du 15 Décembre 1903 | G56: 97-104 | H56: 8 | I56: yes | J56: no
G57: TOTAL PAGE COUNT: | H57: =SUM(R[-30]C:R[-1]C) -> 839
A58: La revue musicale | B58: 4 | C58: 1 | D58: Publication bi-mensuelle Honorée d'une souscription du Ministère de l'Instruction publique et des Beaux-Arts | E58: ML5.R35 | F58: 1er Janvier 1904 | G58: vi-xii; 1-48 | H58: 56 | I58: yes | J58: no
A59: La revue musicale | B59: 4 | C59: 2 | D59: Publication bi-mensuelle Honorée d'une souscription du Ministère de l'Instruction publique et des Beaux-Arts | E59: ML5.R35 | F59: 15 Janvier 1904 | G59: 49-72 | H59: 24 | I59: yes | J59: no
A60: La revue musicale | B60: 4 | C60: 3 | D60: Publication bi-mensuelle Honorée d'une souscription du Ministère de l'Instruction publique et des Beaux-Arts | E60: ML5.R35 | F60: 1er Février 1904 | G60: 73-104 | H60: 32 | I60: yes | J60: no
A61: La revue musicale | B61: 4 | C61: 4 | D61: Publication bi-mensuelle Honorée d'une souscription du Ministère de l'Instruction publique et des Beaux-Arts | E61: ML5.R35 | F61: 15 Février 1904 | G61: 105-128 | H61: 24 | I61: yes | J61: no
A62: La revue musicale | B62: 4 | C62: 5 | D62: Publication bi-mensuelle Honorée d'une souscription du Ministère de l'Instruction publique et des Beaux-Arts | E62: ML5.R35 | F62: 1er Mars | G62: 129-152 | H62: 24 | I62: yes | J62: no
A63: La revue musicale | B63: 4 | C63: 6 | D63: Publication bi-mensuelle Honorée d'une souscription du Ministère de l'Instruction publique et des Beaux-Arts | E63: ML5.R35 | F63: 15 Mars 1904 | G63: 153-176 | H63: 24 | I63: yes | J63: no
A64: La revue musicale | B64: 4 | C64: 7 | D64: Publication bi-mensuelle Honorée d'une souscription du Ministère de l'Instruction publique et des Beaux-Arts | E64: ML5.R35 | F64: 1er Avril 1904 | G64: 177-200 | H64: 24 | I64: yes | J64: no
A65: La revue musicale | B65: 4 | C65: 8 | D65: Publication bi-mensuelle Honorée d'une souscription du Ministère de l'Instruction publique et des Beaux-Arts | E65: ML5.R35 | F65: 15 Avril 1904 | G65: 201-224 | H65: 24 | I65: yes | J65: no
A66: La revue musicale | B66: 4 | C66: 9 | D66: Publication bi-mensuelle Honorée d'une souscription du Ministère de l'Instruction publique et des Beaux-Arts | E66: ML5.R35 | F66: 1er Mai 1904 | G66: 225-248 | H66: 24 | I66: yes | J66: no
A67: La revue musicale | B67: 4 | C67: 10 | D67: Publication bi-mensuelle Honorée d'une souscription du Ministère de l'Instruction publique et des Beaux-Arts | E67: ML5.R35 | F67: 15 Mai 1904 | G67: 249-272 | H67: 24 | I67: yes | J67: no
A68: La revue musicale | B68: 4 | C68: 11 | D68: Publication bi-mensuelle Honorée d'une souscription du Ministère de l'Instruction publique et des Beaux-Arts | E68: ML5.R35 | F68: 1er Juin 1904 | G68: 273-296 | H68: 24 | I68: yes | J68: no
A69: La revue musicale | B69: 4 | C69: 12 | D69: Publication bi-mensuelle Honorée d'une souscription du Ministère de l'Instruction publique et des Beaux-Arts | E69: ML5.R35 | F69: 15 Juin 1904 | G69: 297-320 | H69: 24 | I69: yes | J69: no
A70: La revue musicale | B70: 4 | C70: 13 | D70: Publication bi-mensuelle Honorée d'une souscription du Ministère de l'Instruction publique et des Beaux-Arts | E70: ML5.R35 | F70: 1er Juillet 1904 | G70: 321-344 | H70: 24 | I70: yes | J70: no
A71: La revue musicale | B71: 4 | C71: 14 | D71: Publication bi-mensuelle Honorée d'une souscription du Ministère de l'Instruction publique et des Beaux-Arts | E71: ML5.R35 | F71: 15 Juillet 1904 | G71: 345-368 | H71: 24 | I71: yes | J71: no
A72: La revue musicale | B72: 4 | C72: 15 - 16 | D72: Publication bi-mensuelle Honorée d'une souscription du Ministère de l'Instruction publique et des Beaux-Arts | E72: ML5.R35 | F72: 5 Août 1904 | G72: 369-400 | H72: 32 | I72: yes | J72: no
A73: La revue musicale | B73: 4 | C73: 17 - 18 | D73: Publication bi-mensuelle Honorée d'une souscription du Ministère de l'Instruction publique et des Beaux-Arts | E73: ML5.R35 | F73: 10 Septembre 1904 | G73: 401-432 | H73: 32 | I73: yes | J73: no
A74: La revue musicale | B74: 4 | C74: 19 | D74: Publication bi-mensuelle Honorée d'une souscription du Ministère de l'Instruction publique et des Beaux-Arts | E74: ML5.R35 | F74: 1er Octobre 1904 | G74: 433-480 | H74: 48 | I74: yes | J74: no
A75: La revue musicale | B75: 4 | C75: 20 | D75: Publication bi-mensuelle Honorée d'une souscription du Ministère de l'Instruction publique et des Beaux-Arts | E75: ML5.R35 | F75: 15 Octobre 1904 | G75: 481-512 | H75: 32 | I75: yes | J75: no
A76: La revue musicale | B76: 4 | C76: 21 | D76: Publication bi-mensuelle Honorée d'une souscription du Ministère de l'Instruction publique et des Beaux-Arts | E76: ML5.R35 | F76: 1er Novembre 1904 | G76: 513-536 | H76: 24 | I76: yes | J76: no
A77: La revue musicale | B77: 4 | C77: 22 | D77: Publication bi-mensuelle Honorée d'une souscription du Ministère de l'Instruction publique et des Beaux-Arts | E77: ML5.R35 | F77: 15 Novembre 1904 | G77: 537-560 | H77: 24 | I77: yes | J77: no
A78: La revue musicale | B78: 4 | C78: 23 | D78: Publication bi-mensuelle Honorée d'une souscription du Ministère de l'Instruction publique et des Beaux-Arts | E78: ML5.R35 | F78: 1er Décembre 1904 | G78: 561-584 | H78: 24 | I78: yes | J78: no
A79: La revue musicale | B79: 4 | C79: 24 | D79: Publication bi-mensuelle Honorée d'une souscription du Ministère de l'Instruction publique et des Beaux-Arts | E79: ML5.R35 | F79: 15 Décembre 1904 | G79: 585-632 | H79: 48 | I79: yes | J79: no
A80: La revue musicale | B80: 4 | C80: Supplément 11e Série | D80: Anthologie de la "Revue Musicale" | E80: ML5.R35 | F80: 1er Janvier 1904 | G80: 1-8 | H80: 8 | I80: yes | J80: no
A81: La revue musicale | B81: 4 | C81: Supplément 11e Série | D81: Anthologie de la "Revue Musicale" | E81: ML5.R35 | F81: 15 Janvier 1904 | G81: 9-16 | H81: 8 | I81: yes | J81: no
A82: La revue musicale | B82: 4 | C82: Supplément 11e Série | D82: Anthologie de la "Revue Musicale" | E82: ML5.R35 | F82: 1er Février 1904 | G82: 17-24 | H82: 8 | I82: yes | J82: no
A83: La revue musicale | B83: 4 | C83: Supplément 11e Série | D83: Anthologie de la "Revue Musicale" | E83: ML5.R35 | F83: 15 Février 1904 | G83: 25-32 | H83: 8 | I83: yes | J83: no
A84: La revue musicale | B84: 4 | C84: Supplément 11e Série | D84: Anthologie de la "Revue Musicale" | E84: ML5.R35 | F84: 1er Mars 1904 | G84: 33-40 | H84: 8 | I84: yes | J84: no
A85: La revue musicale | B85: 4 | C85: Supplément 11e Série | D85: Anthologie de la "Revue Musicale" | E85: ML5.R35 | F85: 15 Mars 1904 | G85: 41-48 | H85: 8 | I85: yes | J85: no
A86: La revue musicale | B86: 4 | C86: Supplément 11e Série | D86: Anthologie de la "Revue Musicale" | E86: ML5.R35 | F86: 1er Avril 1904 | G86: 49-56 | H86: 8 | I86: yes | J86: no
A87: La revue musicale | B87: 4 | C87: Supplément 11e Série | D87: Anthologie de la "Revue Musicale" | E87: ML5.R35 | F87: 15 Avril 1904 | G87: 57-64 | H87: 8 | I87: yes | J87: no
A88: La revue musicale | B88: 4 | C88: Supplément 11e Série | D88: Anthologie de la "Revue Musicale" | E88: ML5.R35 | F88: 1er Mai 1904 | G88: 65-72 | H88: 8 | I88: yes | J88: no
A89: La revue musicale | B89: 4 | C89: Supplément 11e Série | D89: Anthologie de la "Revue Musicale" | E89: ML5.R35 | F89: 15 Mai 1904 | G89: 73-80 | H89: 8 | I89: yes | J89: no
A90: La revue musicale | B90: 4 | C90: Supplément 11e Série | D90: Anthologie de la "Revue Musicale" | E90: ML5.R35 | F90: 1er Juin 1904 | G90: 81-88 | H90: 8 | I90: yes | J90: no
A91: La revue musicale | B91: 4 | C91: Supplément 11e Série | D91: Anthologie de la "Revue Musicale" | E91: ML5.R35 | F91: 15 Juin 1904 | G91: 89-96 | H91: 8 | I91: yes | J91: no
A92: La revue musicale | B92: 4 | C92: Supplément 11e Série | D92: Anthologie de la "Revue Musicale" | E92: ML5.R35 | F92: 1er Juillet 1904 | G92: 97-112 | H92: 16 | I92: yes | J92: no
A93: La revue musicale | B93: 4 | C93: Supplément 11e Série | D93: Anthologie de la "Revue Musicale" | E93: ML5.R35 | F93: 15 Juillet 1904 | G93: 113-116 | H93: 4 | I93: yes | J93: no
A94: La revue musicale | B94: 4 | C94: Supplément 11e Série | D94: Anthologie de la "Revue Musicale" | E94: ML5.R35 | F94: 1er Août 1904 | G94: 117-124 | H94: 8 | I94: yes | J94: no
A95: La revue musicale | B95: 4 | C95: Supplément 11e Série | D95: Anthologie de la "Revue Musicale" | E95: ML5.R35 | F95: 10 Septembre 1904 | G95: 125-128 | H95: 4 | I95: yes | J95: no
A96: La revue musicale | B96: 4 | C96: Supplément 11e Série | D96: Anthologie de la "Revue Musicale" | E96: ML5.R35 | F96: 1er Octobre 1904 | G96: 129-132 [actual page nos. 1-4] | H96: 4 | I96: yes | J96: no
A97: La revue musicale | B97: 4 | C97: Supplément 11e Série | D97: Anthologie de la "Revue Musicale" | E97: ML5.R35 | F97: 15 Octobre 1904 | G97: 133-140 | H97: 8 | I97: yes | J97: no
A98: La revue musicale | B98: 4 | C98: Supplément 11e Série | D98: Anthologie de la "Revue Musicale" | E98: ML5.R35 | F98: 1er Novembre 1904 | G98: 141-158 [actual page nos. 141-148; 1-10] | H98: 18 | I98: yes | J98: no
A99: La revue musicale | B99: 4 | C99: Supplément 11e Série | D99: Anthologie de la "Revue Musicale" | E99: ML5.R35 | F99: 1er Décembre 1904 | G99: 159-162 | H99: 4 | I99: yes | J99: no
A100: La revue musicale | B100: 4 | C100: Supplément 11e Série | D100: Anthologie de la "Revue Musicale" | E100: ML5.R35 | F100: 15 Décembre 1904 | G100: 163-166 | H100: 4 | I100: yes | J100: no
G101: TOTAL PAGE COUNT: | H101: =SUM(R[-43]C:R[-1]C) -> 750
A102: La revue musicale | B102: 5 | C102: 1 | D102: Publication bi-mensuelle Honorée d'une souscription du Ministère de l'Instruction publique et des Beaux-Arts | E102: ML5.R35 | F102: 1er Janvier 1905 | G102: vi-xii; 1-40 | H102: 49 | I102: yes | J102: no
A103: La revue musicale | B103: 5 | C103: 2 | D103: Publication bi-mensuelle Honorée d'une souscription du Ministère de l'Instruction publique et des Beaux-Arts | E103: ML5.R35 | F103: 15 Janvier 1905 | G103: 41-72 | H103: 62 | I103: yes | J103: no
A104: La revue musicale | B104: 5 | C104: 3 | D104: Publication bi-mensuelle Honorée d'une souscription du Ministère de l'Instruction publique et des Beaux-Arts | E104: ML5.R35 | F104: 1 Février 1905 | G104: 73-104 | H104: 32 | I104: yes | J104: no
A105: La revue musicale | B105: 5 | C105: 4 | D105: Publication bi-mensuelle Honorée d'une souscription du Ministère de l'Instruction publique et des Beaux-Arts | E105: ML5.R35 | F105: 15 Février 1905 | G105: 105-128 | H105: 24 | I105: yes | J105: no
A106: La revue musicale | B106: 5 | C106: 5 | D106: Publication bi-mensuelle Honorée d'une souscription du Ministère de l'Instruction publique et des Beaux-Arts | E106: ML5.R35 | F106: 1er Mars 1905 | G106: 129-176 | H106: 48 | I106: yes | J106: no
A107: La revue musicale | B107: 5 | C107: 6 | D107: Publication bi-mensuelle Honorée d'une souscription du Ministère de l'Instruction publique et des Beaux-Arts | E107: ML5.R35 | F107: 15 Mars 1905 | G107: 177-200 | H107: 24 | I107: yes | J107: no
A108: La revue musicale | B108: 5 | C108: 7 | D108: Publication bi-mensuelle Honorée d'une souscription du Ministère de l'Instruction publique et des Beaux-Arts | E108: ML5.R35 | F108: 1er Avril 1905 | G108: 201-224 | H108: 24 | I108: yes | J108: no
A109: La revue musicale | B109: 5 | C109: 8 | D109: Publication bi-mensuelle Honorée d'une souscription du Ministère de l'Instruction publique et des Beaux-Arts | E109: ML5.R35 | F109: 15 Avril 1905 | G109: 225-248 | H109: 24 | I109: yes | J109: no
A110: La revue musicale | B110: 5 | C110: 9 | D110: Publication bi-mensuelle Honorée d'une souscription du Ministère de l'Instruction publique et des Beaux-Arts | E110: ML5.R35 | F110: 1er Mai 1905 | G110: 249-272 | H110: 24 | I110: yes | J110: no
A111: La revue musicale | B111: 5 | C111: 10 | D111: Publication bi-mensuelle Honorée d'une souscription du Ministère de l'Instruction publique et des Beaux-Arts | E111: ML5.R35 | F111: 15 Mai 1905 | G111: 273-296 | H111: 24 | I111: yes | J111: no
A112: La revue musicale | B112: 5 | C112: 11 | D112: Publication bi-mensuelle Honorée d'une souscription du Ministère de l'Instruction publique et des Beaux-Arts | E112: ML5.R35 | F112: 1er Juin 1905 | G112: 297-320 | H112: 24 | I112: yes | J112: no
A113: La revue musicale | B113: 5 | C113: 12 | D113: Publication bi-mensuelle Honorée d'une souscription du Ministère de l'Instruction publique et des Beaux-Arts | E113: ML5.R35 | F113: 15 Juin 1905 | G113: 321-348 | H113: 28 | I113: yes | J113: no
A114: La revue musicale | B114: 5 | C114: 13 | D114: Publication bi-mensuelle Honorée d'une souscription du Ministère de l'Instruction publique et des Beaux-Arts | E114: ML5.R35 | F114: 1er Juillet 1905 | G114: 349-372 | H114: 24 | I114: yes | J114: no
A115: La revue musicale | B115: 5 | C115: 14 | D115: Publication bi-mensuelle Honorée d'une souscription du Ministère de l'Instruction publique et des Beaux-Arts | E115: ML5.R35 | F115: 15 Juillet 1905 | G115: 373-396 | H115: 24 | I115: yes | J115: no
A116: La revue musicale | B116: 5 | C116: 15 | D116: Publication bi-mensuelle Honorée d'une souscription du Ministère de l'Instruction publique et des Beaux-Arts | E116: ML5.R35 | F116: 5 Août 1905 | G116: 397-420 | H116: 24 | I116: yes | J116: no
A117: La revue musicale | B117: 5 | C117: 16 - 17 | D117: Publication bi-mensuelle Honorée d'une souscription du Ministère de l'Instruction publique et des Beaux-Arts | E117: ML5.R35 | F117: 1er Septembre 1905 | G117: 421-452 | H117: 32 | I117: yes | J117: no
A118: La revue musicale | B118: 5 | C118: 18 | D118: Publication bi-mensuelle Honorée d'une souscription du Ministère de l'Instruction publique et des Beaux-Arts | E118: ML5.R35 | F118: 1er Octobre 1905 | G118: 453-468 | H118: 16 | I118: yes | J118: no
A119: La revue musicale | B119: 5 | C119: 19 | D119: Publication bi-mensuelle Honorée d'une souscription du Ministère de l'Instruction publique et des Beaux-Arts | E119: ML5.R35 | F119: 15 Octobre 1905 | G119: 469-496 | H119: 28 | I119: yes | J119: no
A120: La revue musicale | B120: 5 | C120: 20 | D120: Publication bi-mensuelle Honorée d'une souscription du Ministère de l'Instruction publique et des Beaux-Arts | E120: ML5.R35 | F120: 1er Novembre 1905 | G120: [497-528; 545-560] | H120: 48 | I120: yes | J120: no
A121: La revue musicale | B121: 5 | C121: 21 | D121: Publication bi-mensuelle Honorée d'une souscription du Ministère de l'Instruction publique et des Beaux-Arts | E121: ML5.R35 | F121: 15 Novembre 1905 | G121: 529-544 | H121: 16 | I121: yes | J121: no
A122: La revue musicale | B122: 5 | C122: 22 | D122: Publication bi-mensuelle Honorée d'une souscription du Ministère de l'Instruction publique et des Beaux-Arts | E122: ML5.R35 | F122: 1er Décembre 1905 | G122: 561-600; 617-632 | H122: 56 | I122: yes | J122: no
A123: La revue musicale | B123: 5 | C123: 23 | D123: Publication bi-mensuelle Honorée d'une souscription du Ministère de l'Instruction publique et des Beaux-Arts | E123: ML5.R35 | F123: 15 Décembre 1905 | G123: 601-616 | H123: 16 | I123: yes | J123: no
A124: La revue musicale | B124: 5 | D124: Publication bi-mensuelle Honorée d'une souscription du Ministère de l'Instruction publique et des Beaux-Arts | E124: ML5.R35 | F124: Supplément à la "Revue Musicale" du 1er Janvier 1905 | G124: 167-170 | H124: 4 | I124: yes | J124: no
A125: La revue musicale | B125: 5 | D125: Publication bi-mensuelle Honorée d'une souscription du Ministère de l'Instruction publique et des Beaux-Arts | E125: ML5.R35 | F125: Supplément à la "Revue Musicale" du 15 Janvier 1905 | G125: 171-174 | H125: 4 | I125: yes | J125: no
A126: La revue musicale | B126: 5 | D126: Publication bi-mensuelle Honorée d'une souscription du Ministère de l'Instruction publique et des Beaux-Arts | E126: ML5.R35 | F126: Supplément à la "Revue Musicale" du 1er Février 1905 | G126: 175-182 | H126: 8 | I126: yes | J126: no
A127: La revue musicale | B127: 5 | D127: Publication bi-mensuelle Honorée d'une souscription du Ministère de l'Instruction publique et des Beaux-Arts | E127: ML5.R35 | F127: Supplément à la "Revue Musicale" du 15 Février 1905 | G127: 183-190 | H127: 8 | I127: yes | J127: no
A128: La revue musicale | B128: 5 | D128: Publication bi-mensuelle Honorée d'une souscription du Ministère de l'Instruction publique et des Beaux-Arts | E128: ML5.R35 | F128: Supplément à la "Revue Musicale" du 1er Mars 1905 | G128: 191-198 | H128: 8 | I128: yes | J128: no
A129: La revue musicale | B129: 5 | D129: Publication bi-mensuelle Honorée d'une souscription du Ministère de l'Instruction publique et des Beaux-Arts | E129: ML5.R35 | F129: Supplément à la "Revue Musicale" du 15 Mars 1905 | G129: 199-202 | H129: 4 | I129: yes | J129: no
A130: La revue musicale | B130: 5 | D130: Publication bi-mensuelle Honorée d'une souscription du Ministère de l'Instruction publique et des Beaux-Arts | E130: ML5.R35 | F130: Supplément à la "Revue Musicale" du 1er Avirl 1905 | G130: 203-206 | H130: 4 | I130: yes | J130: no
A131: La revue musicale | B131: 5 | D131: Publication bi-mensuelle Honorée d'une souscription du Ministère de l'Instruction publique et des Beaux-Arts | E131: ML5.R35 | F131: Supplément à la "Revue Musicale" du 15 Avril 1905 | G131: 207-210 | H131: 4 | I131: yes | J131: no
A132: La revue musicale | B132: 5 | D132: Publication bi-mensuelle Honorée d'une souscription du Ministère de l'Instruction publique et des Beaux-Arts | E132: ML5.R35 | F132: Supplément à la "Revue Musicale" du 1er Mai 1905 | G132: 211-226 | H132: 16 | I132: yes | J132: no
A133: La revue musicale | B133: 5 | D133: Publication bi-mensuelle Honorée d'une souscription du Ministère de l'Instruction publique et des Beaux-Arts | E133: ML5.R35 | F133: Supplément à la "Revue Musicale" 15 Mai 1905 | G133: 227-230 | H133: 4 | I133: yes | J133: no
A134: La revue musicale | B134: 5 | D134: Publication bi-mensuelle Honorée d'une souscription du Ministère de l'Instruction publique et des Beaux-Arts | E134: ML5.R35 | F134: Supplément à la "Revue Musicale" 1er Juin 1905 | G134: 231-234 | H134: 4 | I134: yes | J134: no
A135: La revue musicale | B135: 5 | D135: Publication bi-mensuelle Honorée d'une souscription du Ministère de l'Instruction publique et des Beaux-Arts | E135: ML5.R35 | F135: Les Caracteres de la Dance | G135: 1-16 | H135: 16 | I135: yes | J135: no
A136: La revue musicale | B136: 5 | D136: Publication bi-mensuelle Honorée d'une souscription du Ministère de l'Instruction publique et des Beaux-Arts | E136: ML5.R35 | F136: Supplément à la "Revue Musicale" 1er Juillet 1905 | G136: [251-252] | H136: 2 | I136: yes | J136: no
A137: La revue musicale | B137: 5 | D137: Publication bi-mensuelle Honorée d'une souscription du Ministère de l'Instruction publique et des Beaux-Arts | E137: ML5.R35 | F137: Supplément à la "Revue Musicale" 15 Juillet 1905 | G137: 253-272 | H137: 20 | I137: yes | J137: no
A138: La revue musicale | B138: 5 | D138: Publication bi-mensuelle Honorée d'une souscription du Ministère de l'Instruction publique et des Beaux-Arts | E138: ML5.R35 | F138: Supplément à la "Revue Musicale" 1er Août 1905 | G138: 273-276 | H138: 4 | I138: yes | J138: no
A139: La revue musicale | B139: 5 | D139: Publication bi-mensuelle Honorée d'une souscription du Ministère de l'Instruction publique et des Beaux-Arts | E139: ML5.R35 | F139: Supplément à la "Revue Musicale" 1er Septembre 1905 | G139: 277-280 | H139: 4 | I139: yes | J139: no
A140: La revue musicale | B140: 5 | D140: Publication bi-mensuelle Honorée d'une souscription du Ministère de l'Instruction publique et des Beaux-Arts | E140: ML5.R35 | F140: Supplément à la "Revue Musicale" 1er Octobre 1905 | G140: 281-300 | H140: 20 | I140: yes | J140: no
A141: La revue musicale | B141: 5 | D141: Publication bi-mensuelle Honorée d'une souscription du Ministère de l'Instruction publique et des Beaux-Arts | E141: ML5.R35 | F141: Supplément à la "Revue Musicale" 15 Octobre 1905 | G141: 301-302 | H141: 2 | I141: yes | J141: no
A142: La revue musicale | B142: 5 | D142: Publication bi-mensuelle Honorée d'une souscription du Ministère de l'Instruction publique et des Beaux-Arts | E142: ML5.R35 | F142: Supplément à la "Revue Musicale" 1er Novembre 1905 | G142: 303-306 | H142: 4 | I142: yes | J142: no
A143: La revue musicale | B143: 5 | D143: Publication bi-mensuelle Honorée d'une souscription du Ministère de l'Instruction publique et des Beaux-Arts | E143: ML5.R35 | F143: Supplément à la "Revue Musicale" 15 Novembre 1905 | G143: 307-314 | H143: 8 | I143: yes | J143: no
A144: La revue musicale | B144: 5 | D144: Publication bi-mensuelle Honorée d'une souscription du Ministère de l'Instruction publique et des Beaux-Arts | E144: ML5.R35 | F144: Supplément à la "Revue Musicale" 1er Décembre 1905 | G144: 323-338 | H144: 16 | I144: yes | J144: no | K144: binding issue. Loose page 336
A145: La revue musicale | B145: 5 | D145: Publication bi-mensuelle Honorée d'une souscription du Ministère de l'Instruction publique et des Beaux-Arts | E145: ML5.R35 | F145: Supplément à la "Revue Musicale" 15 Décembre 1905 | G145: 331-338 (?) | H145: 8 | I145: yes | J145: no
G146: TOTAL PAGE COUNT: | H146: =SUM(R[-44]C:R[-1]C) -> 819
A147: La revue musicale | B147: 6 | C147: 1 | D147: Publication bi-mensuelle Honorée d'une souscription du Ministère de l'Instruction publique et des Beaux-Arts | E147: ML5.R35 | F147: 1er Janvier 1906 | G147: v-xii; 1-32 | H147: 41 | I147: yes | J147: no
A148: La revue musicale | B148: 6 | C148: 2 | D148: Publication bi-mensuelle Honorée d'une souscription du Ministère de l'Instruction publique et des Beaux-Arts | E148: ML5.R35 | F148: 15 Janvier 1906 | G148: 33-58 | H148: 26 | I148: yes | J148: no
A149: La revue musicale | B149: 6 | C149: 3 | D149: Publication bi-mensuelle Honorée d'une souscription du Ministère de l'Instruction publique et des Beaux-Arts | E149: ML5.R35 | F149: 1er Février 1906 | G149: 59-82 | H149: 24 | I149: yes | J149: no
A150: La revue musicale | B150: 6 | C150: 4 | D150: Publication bi-mensuelle Honorée d'une souscription du Ministère de l'Instruction publique et des Beaux-Arts | E150: ML5.R35 | F150: 15 Février 1906 | G150: 83-106 | H150: 24 | I150: yes | J150: no
A151: La revue musicale | B151: 6 | C151: 5 | D151: Publication bi-mensuelle Honorée d'une souscription du Ministère de l'Instruction publique et des Beaux-Arts | E151: ML5.R35 | F151: 1er Mars 1906 | G151: 107-138 | H151: 32 | I151: yes | J151: no
A152: La revue musicale | B152: 6 | C152: 6 | D152: Publication bi-mensuelle Honorée d'une souscription du Ministère de l'Instruction publique et des Beaux-Arts | E152: ML5.R35 | F152: 15 Mars 1906 | G152: 139-162 | H152: 24 | I152: yes | J152: no
A153: La revue musicale | B153: 6 | C153: 7 | D153: Publication bi-mensuelle Honorée d'une souscription du Ministère de l'Instruction publique et des Beaux-Arts | E153: ML5.R35 | F153: 1er Avril 1906 | G153: 163-186 | H153: 24 | I153: yes | J153: no
A154: La revue musicale | B154: 6 | C154: 8-9 | D154: Publication bi-mensuelle Honorée d'une souscription du Ministère de l'Instruction publique et des Beaux-Arts | E154: ML5.R35 | F154: 15 Avril-1er Mars 1906 | G154: 187-218 | H154: 32 | I154: yes | J154: no
A155: La revue musicale | B155: 6 | C155: 10 | D155: Publication bi-mensuelle Honorée d'une souscription du Ministère de l'Instruction publique et des Beaux-Arts | E155: ML5.R35 | F155: 15 Mai 1906 | G155: 219-250 | H155: 32 | I155: yes | J155: no
A156: La revue musicale | B156: 6 | C156: 11 | D156: Publication bi-mensuelle Honorée d'une souscription du Ministère de l'Instruction publique et des Beaux-Arts | E156: ML5.R35 | F156: 1er Juin 1906 | G156: 251-282 | H156: 32 | I156: yes | J156: no
A157: La revue musicale | B157: 6 | C157: 12 | D157: Publication bi-mensuelle Honorée d'une souscription du Ministère de l'Instruction publique et des Beaux-Arts | E157: ML5.R35 | F157: 15 Juin 1906 | G157: 283-306 | H157: 24 | I157: yes | J157: no
A158: La revue musicale | B158: 6 | C158: 13 | D158: Publication bi-mensuelle Honorée d'une souscription du Ministère de l'Instruction publique et des Beaux-Arts | E158: ML5.R35 | F158: 1er Juillet 1906 | G158: 307-338 | H158: 32 | I158: yes | J158: no
A159: La revue musicale | B159: 6 | C159: 14 | D159: Publication bi-mensuelle Honorée d'une souscription du Ministère de l'Instruction publique et des Beaux-Arts | E159: ML5.R35 | F159: 15 Juillet 1906 | G159: 339-362 | H159: 24 | I159: yes | J159: no
A160: La revue musicale | B160: 6 | C160: 15 | D160: Publication bi-mensuelle Honorée d'une souscription du Ministère de l'Instruction publique et des Beaux-Arts | E160: ML5.R35 | F160: 1er Août 1906 | G160: 363-394 | H160: 32 | I160: yes | J160: no
A161: La revue musicale | B161: 6 | C161: 16 | D161: Publication bi-mensuelle Honorée d'une souscription du Ministère de l'Instruction publique et des Beaux-Arts | E161: ML5.R35 | F161: 1er Septembre 1906 | G161: 395-434 | H161: 40 | I161: yes | J161: no
A162: La revue musicale | B162: 6 | C162: 17 | D162: Publication bi-mensuelle Honorée d'une souscription du Ministère de l'Instruction publique et des Beaux-Arts | E162: ML5.R35 | F162: 1er Octobre 1906 | G162: 435-458 | H162: 24 | I162: yes | J162: no
A163: La revue musicale | B163: 6 | C163: 19-20 | D163: Publication bi-mensuelle Honorée d'une souscription du Ministère de l'Instruction publique et des Beaux-Arts | E163: ML5.R35 | F163: 15 Octobre 1906 | G163: 459-488 | H163: 30 | I163: yes | J163: no
A164: La revue musicale | B164: 6 | C164: 21 | D164: Publication bi-mensuelle Honorée d'une souscription du Ministère de l'Instruction publique et des Beaux-Arts | E164: ML5.R35 | F164: 1er Novembre 1906 | G164: 489-512 | H164: 24 | I164: yes | J164: no
A165: La revue musicale | B165: 6 | C165: 22 | D165: Publication bi-mensuelle Honorée d'une souscription du Ministère de l'Instruction publique et des Beaux-Arts | E165: ML5.R35 | F165: 15 Novembre 1906 | G165: 513-536 | H165: 24 | I165: yes | J165: no
A166: La revue musicale | B166: 6 | C166: 23 | D166: Publication bi-mensuelle Honorée d'une souscription du Ministère de l'Instruction publique et des Beaux-Arts | E166: ML5.R35 | F166: 1er Décembre 1906 | G166: 537-568 | H166: 32 | I166: yes | J166: no
A167: La revue musicale | B167: 6 | C167: 24 | D167: Publication bi-mensuelle Honorée d'une souscription du Ministère de l'Instruction publique et des Beaux-Arts | E167: ML5.R35 | F167: 15 Décembre 1906 | G167: 569-592 | H167: 24 | I167: yes | J167: no
A168: La revue musicale | B168: 6 | D168: Publication bi-mensuelle Honorée d'une souscription du Ministère de l'Instruction publique et des Beaux-Arts | E168: ML5.R35 | F168: Supplément à la "Revue Musicale" du 1er Janvier 1906 | G168: 339-346 | H168: 8 | I168: yes | J168: no
A169: La revue musicale | B169: 6 | D169: Publication bi-mensuelle Honorée d'une souscription du Ministère de l'Instruction publique et des Beaux-Arts | E169: ML5.R35 | F169: Supplément à la "Revue Musicale" du 15 Février 1906 | G169: 347-354 | H169: 8 | I169: yes | J169: no
A170: La revue musicale | B170: 6 | D170: Publication bi-mensuelle Honorée d'une souscription du Ministère de l'Instruction publique et des Beaux-Arts | E170: ML5.R35 | F170: Supplément à la "Revue Musicale" du 15 Mars 1906 | G170: 1-4 | H170: 4 | I170: yes | J170: no
A171: La revue musicale | B171: 6 | D171: Publication bi-mensuelle Honorée d'une souscription du Ministère de l'Instruction publique et des Beaux-Arts | E171: ML5.R35 | F171: Supplément à la Revue Musicale du 1er Avril 1906 | G171: 76-90 | H171: 15 | I171: yes | J171: no
A172: La revue musicale | B172: 6 | D172: Publication bi-mensuelle Honorée d'une souscription du Ministère de l'Instruction publique et des Beaux-Arts | E172: ML5.R35 | F172: Supplément à la Revue Musicale du 15 Avril 1906 | G172: 148-162 | H172: 18 | I172: yes | J172: no
A173: La revue musicale | B173: 6 | D173: Publication bi-mensuelle Honorée d'une souscription du Ministère de l'Instruction publique et des Beaux-Arts | E173: ML5.R35 | F173: Supplément à la Revue Musicale du 15 Juin 1906 | G173: 57-62 | H173: 6 | I173: yes | J173: no
A174: La revue musicale | B174: 6 | D174: Publication bi-mensuelle Honorée d'une souscription du Ministère de l'Instruction publique et des Beaux-Arts | E174: ML5.R35 | F174: Supplément à la Revue Musicale du 1er Août 1906 | G174: 1-2 [piano] 1-6 [violon] | H174: 8 | I174: yes | J174: no
A175: La revue musicale | B175: 6 | D175: Publication bi-mensuelle Honorée d'une souscription du Ministère de l'Instruction publique et des Beaux-Arts | E175: ML5.R35 | F175: Supplément à la Revue Musicale du 1. Septembre 1906 | G175: 1-8 | H175: 8 | I175: yes | J175: no
A176: La revue musicale | B176: 6 | D176: Publication bi-mensuelle Honorée d'une souscription du Ministère de l'Instruction publique et des Beaux-Arts | E176: ML5.R35 | F176: Supplément à la Revue Musicale 1er Octobre 1906 | G176: 1-4 | H176: 4 | I176: yes | J176: no
A177: La revue musicale | B177: 6 | D177: Publication bi-mensuelle Honorée d'une souscription du Ministère de l'Instruction publique et des Beaux-Arts | E177: ML5.R35 | F177: Supplément à la Revue Musicale 15 Octobre 1906 | G177: 1-8 | H177: 8 | I177: yes | J177: no
A178: La revue musicale | B178: 6 | D178: Publication bi-mensuelle Honorée d'une souscription du Ministère de l'Instruction publique et des Beaux-Arts | E178: ML5.R35 | F178: Supplément à la Revue Musicale du 1er Novembre 1906 | G178: 1-8 | H178: 8 | I178: yes | J178: no
A179: La revue musicale | B179: 6 | D179: Publication bi-mensuelle Honorée d'une souscription du Ministère de l'Instruction publique et des Beaux-Arts | E179: ML5.R35 | F179: Supplément à la Revue Musicale du 15 Novembre 1906 | G179: 1-8 | H179: 8 | I179: yes | J179: no
A180: La revue musicale | B180: 6 | D180: Publication bi-mensuelle Honorée d'une souscription du Ministère de l'Instruction publique et des Beaux-Arts | E180: ML5.R35 | F180: Supplément à la Revue Musicale 1er Décembre 1906 | G180: 1-4 | H180: 4 | I180: yes | J180: no
A181: La revue musicale | B181: 6 | D181: Publication bi-mensuelle Honorée d'une souscription du Ministère de l'Instruction publique et des Beaux-Arts | E181: ML5.R35 | F181: Supplément à la Revue Musicale du 15 Décembre 1906 | G181: 1-8 | H181: 8 | I181: yes | J181: no
G182: TOTAL PAGE COUNT: | H182: =SUM(R[-35]C:R[-1]C) -> 692
A183: La revue musicale | B183: 7 | C183: 1 | D183: Publication bi-mensuelle Honorée d'une souscription du Ministère de l'Instruction publique et des Beaux-Arts | E183: ML5.R35 | F183: 1er Janvier 1907 | G183: v-ix; 1-24 | H183: 31 | I183: yes | J183: no
A184: La revue musicale | B184: 7 | C184: 2 | D184: Publication bi-mensuelle Honorée d'une souscription du Ministère de l'Instruction publique et des Beaux-Arts | E184: ML5.R35 | F184: 15 Janvier 1907 | G184: 25-48 | H184: 24 | I184: yes | J184: no
A185: La revue musicale | B185: 7 | C185: 3 | D185: Publication bi-mensuelle Honorée d'une souscription du Ministère de l'Instruction publique et des Beaux-Arts | E185: ML5.R35 | F185: 1er Février 1907 | G185: 49-72 | H185: 24 | I185: yes | J185: no
A186: La revue musicale | B186: 7 | C186: 4 | D186: Publication bi-mensuelle Honorée d'une souscription du Ministère de l'Instruction publique et des Beaux-Arts | E186: ML5.R35 | F186: 15 Février 1907 | G186: 73-104 | H186: 32 | I186: yes | J186: no
A187: La revue musicale | B187: 7 | C187: 5 | D187: Publication bi-mensuelle Honorée d'une souscription du Ministère de l'Instruction publique et des Beaux-Arts | E187: ML5.R35 | F187: 1er Mars 1907 | G187: 105-136 | H187: 32 | I187: yes | J187: no
A188: La revue musicale | B188: 7 | C188: 6 | D188: Publication bi-mensuelle Honorée d'une souscription du Ministère de l'Instruction publique et des Beaux-Arts | E188: ML5.R35 | F188: 15 Mars 1907 | G188: 137-168 | H188: 32 | I188: yes | J188: no
A189: La revue musicale | B189: 7 | C189: 7 | D189: Publication bi-mensuelle Honorée d'une souscription du Ministère de l'Instruction publique et des Beaux-Arts | E189: ML5.R35 | F189: 1er Avril 1907 | G189: 169-200 | H189: 32 | I189: yes | J189: no
A190: La revue musicale | B190: 7 | C190: 8 | D190: Publication bi-mensuelle Honorée d'une souscription du Ministère de l'Instruction publique et des Beaux-Arts | E190: ML5.R35 | F190: 15 Avril 1907 | G190: 201-224 | H190: 24 | I190: yes | J190: no
A191: La revue musicale | B191: 7 | C191: 9 | D191: Publication bi-mensuelle Honorée d'une souscription du Ministère de l'Instruction publique et des Beaux-Arts | E191: ML5.R35 | F191: 1er Mai 1907 | G191: 225-240 | H191: 16 | I191: yes | J191: no
A192: La revue musicale | B192: 7 | C192: 10 | D192: Publication bi-mensuelle Honorée d'une souscription du Ministère de l'Instruction publique et des Beaux-Arts | E192: ML5.R35 | F192: 15 Mai 1907 | G192: 241-276 | H192: 36 | I192: yes | J192: no
A193: La revue musicale | B193: 7 | C193: 11 | D193: Publication bi-mensuelle Honorée d'une souscription du Ministère de l'Instruction publique et des Beaux-Arts | E193: ML5.R35 | F193: 1er Juin 1907 | G193: 277-300 | H193: 24 | I193: yes | J193: no
A194: La revue musicale | B194: 7 | C194: 12 | D194: Publication bi-mensuelle Honorée d'une souscription du Ministère de l'Instruction publique et des Beaux-Arts | E194: ML5.R35 | F194: 15 Juin 1907 | G194: 301-332 | H194: 32 | I194: yes | J194: no
A195: La revue musicale | B195: 7 | C195: 13 | D195: Publication bi-mensuelle Honorée d'une souscription du Ministère de l'Instruction publique et des Beaux-Arts | E195: ML5.R35 | F195: 1er Juillet 1907 | G195: 333-364 | H195: 32 | I195: yes | J195: no
A196: La revue musicale | B196: 7 | C196: 14 | D196: Publication bi-mensuelle Honorée d'une souscription du Ministère de l'Instruction publique et des Beaux-Arts | E196: ML5.R35 | F196: 15 Juillet 1907 | G196: 365-396 | H196: 35 | I196: yes | J196: no
A197: La revue musicale | B197: 7 | C197: 15 | D197: Publication bi-mensuelle Honorée d'une souscription du Ministère de l'Instruction publique et des Beaux-Arts | E197: ML5.R35 | F197: 1er Août 1907 | G197: 397-420 | H197: 24 | I197: yes | J197: no
A198: La revue musicale | B198: 7 | C198: 16-17 | D198: Publication bi-mensuelle Honorée d'une souscription du Ministère de l'Instruction publique et des Beaux-Arts | E198: ML5.R35 | F198: 15 Août - 1er Septembre 1907 | G198: 421-444 | H198: 24 | I198: yes | J198: no
A199: La revue musicale | B199: 7 | C199: 18-19 | D199: Publication bi-mensuelle Honorée d'une souscription du Ministère de l'Instruction publique et des Beaux-Arts | E199: ML5.R35 | F199: 15 Septembre - 1er Octobre 1907 | G199: 445-468 | H199: 24 | I199: yes | J199: no
A200: La revue musicale | B200: 7 | C200: 20 | D200: Publication bi-mensuelle Honorée d'une souscription du Ministère de l'Instruction publique et des Beaux-Arts | E200: ML5.R35 | F200: 15 Octobre 1907 | G200: 469-492 | H200: 24 | I200: yes | J200: no
A201: La revue musicale | B201: 7 | C201: 21 | D201: Publication bi-mensuelle Honorée d'une souscription du Ministère de l'Instruction publique et des Beaux-Arts | E201: ML5.R35 | F201: 1er Novembre 1907 | G201: 493-516 | H201: 24 | I201: yes | J201: no
A202: La revue musicale | B202: 7 | C202: 22 | D202: Publication bi-mensuelle Honorée d'une souscription du Ministère de l'Instruction publique et des Beaux-Arts | E202: ML5.R35 | F202: 15 Novembre 1907 | G202: 517-548 | H202: 32 | I202: yes | J202: no
A203: La revue musicale | B203: 7 | C203: 23 | D203: Publication bi-mensuelle Honorée d'une souscription du Ministère de l'Instruction publique et des Beaux-Arts | E203: ML5.R35 | F203: 1er Décembre 1907 | G203: 549-580 | H203: 32 | I203: yes | J203: no
A204: La revue musicale | B204: 7 | C204: 24 | D204: Publication bi-mensuelle Honorée d'une souscription du Ministère de l'Instruction publique et des Beaux-Arts | E204: ML5.R35 | F204: 15 Décembre 1907 | G204: 581-612 | H204: 32 | I204: yes | J204: no
G205: TOTAL PAGE COUNT: | H205: =SUM(R[-22]C:R[-1]C) -> 622
A206: La revue musicale | B206: 8 | C206: 1 | D206: Publication bi-mensuelle Honorée d'une souscription du Ministère de l'Instruction publique et des Beaux-Arts | E206: ML5.R35 | F206: 1er Janvier 1908 | G206: v-ix; 1-32 | H206: 39 | I206: yes | J206: no | K206: some fragile pages; pencil notes in margin
A207: La revue musicale | B207: 8 | C207: 2 | D207: Publication bi-mensuelle Honorée d'une souscription du Ministère de l'Instruction publique et des Beaux-Arts | E207: ML5.R35 | F207: 15 Janvier 1908 | G207: 33-64 | H207: 32 | I207: yes | J207: no
A208: La revue musicale | B208: 8 | C208: 3 | D208: Publication bi-mensuelle Honorée d'une souscription du Ministère de l'Instruction publique et des Beaux-Arts | E208: ML5.R35 | F208: 1er Février 1908 | G208: 65-96 | H208: 32 | I208: yes | J208: no
A209: La revue musicale | B209: 8 | C209: 4 | D209: Publication bi-mensuelle Honorée d'une souscription du Ministère de l'Instruction publique et des Beaux-Arts | E209: ML5.R35 | F209: 15 Février 1908 | G209: 97-128 | H209: 32 | I209: yes | J209: no
A210: La revue musicale | B210: 8 | C210: 5 | D210: Publication bi-mensuelle Honorée d'une souscription du Ministère de l'Instruction publique et des Beaux-Arts | E210: ML5.R35 | F210: 1er Mars 1908 | G210: 129-160 | H210: 32 | I210: yes | J210: no
A211: La revue musicale | B211: 8 | C211: 6 | D211: Publication bi-mensuelle Honorée d'une souscription du Ministère de l'Instruction publique et des Beaux-Arts | E211: ML5.R35 | F211: 15 Mars 1908 | G211: 161-192 | H211: 32 | I211: yes | J211: no
A212: La revue musicale | B212: 8 | C212: 7 | D212: Publication bi-mensuelle Honorée d'une souscription du Ministère de l'Instruction publique et des Beaux-Arts | E212: ML5.R35 | F212: 1er Avril 1908 | G212: 193-224 | H212: 32 | I212: yes | J212: no
A213: La revue musicale | B213: 8 | C213: 8 | D213: Publication bi-mensuelle Honorée d'une souscription du Ministère de l'Instruction publique et des Beaux-Arts | E213: ML5.R35 | F213: 15 Avril 1908 | G213: 225-256 | H213: 32 | I213: yes | J213: no
A214: La revue musicale | B214: 8 | C214: 9 | D214: Publication bi-mensuelle Honorée d'une souscription du Ministère de l'Instruction publique et des Beaux-Arts | E214: ML5.R35 | F214: 1er Mai 1908 | G214: 257-288 | H214: 32 | I214: yes | J214: no
A215: La revue musicale | B215: 8 | C215: 10 | D215: Publication bi-mensuelle Honorée d'une souscription du Ministère de l'Instruction publique et des Beaux-Arts | E215: ML5.R35 | F215: 15 Mai 1908 | G215: 289-312 | H215: 24 | I215: yes | J215: no
A216: La revue musicale | B216: 8 | C216: 11 | D216: Publication bi-mensuelle Honorée d'une souscription du Ministère de l'Instruction publique et des Beaux-Arts | E216: ML5.R35 | F216: 1er Juin 1908 | G216: 313-336 | H216: 24 | I216: yes | J216: no
A217: La revue musicale | B217: 8 | C217: 12 | D217: Publication bi-mensuelle Honorée d'une souscription du Ministère de l'Instruction publique et des Beaux-Arts | E217: ML5.R35 | F217: 15 Juin 1908 | G217: 337-368 | H217: 32 | I217: yes | J217: no
A218: La revue musicale | B218: 8 | C218: 13 | D218: Publication bi-mensuelle Honorée d'une souscription du Ministère de l'Instruction publique et des Beaux-Arts | E218: ML5.R35 | F218: 1er Mai 1908 [1er Juillet 1908] ?? | G218: 369-400 | H218: 32 | I218: yes | J218: no
A219: La revue musicale | B219: 8 | C219: 14 | D219: Publication bi-mensuelle Honorée d'une souscription du Ministère de l'Instruction publique et des Beaux-Arts | E219: ML5.R35 | F219: 15 Juillet 1908 | G219: 401-424 | H219: 24 | I219: yes | J219: no
A220: La revue musicale | B220: 8 | C220: 15 | D220: Publication bi-mensuelle Honorée d'une souscription du Ministère de l'Instruction publique et des Beaux-Arts | E220: ML5.R35 | F220: 1er Août 1908 | G220: 425-448 | H220: 24 | I220: yes | J220: no
A221: La revue musicale | B221: 8 | C221: 16-17 | D221: Publication bi-mensuelle Honorée d'une souscription du Ministère de l'Instruction publique et des Beaux-Arts | E221: ML5.R35 | F221: 15 Août - 1er Septembre 1908 | G221: 449-496 | H221: 48 | I221: yes | J221: no
A222: La revue musicale | B222: 8 | C222: 18-19 | D222: Publication bi-mensuelle Honorée d'une souscription du Ministère de l'Instruction publique et des Beaux-Arts | E222: ML5.R35 | F222: 15 Septembre - 1er Octobre 1908 | G222: 497-540 | H222: 44 | I222: yes | J222: no
A223: La revue musicale | B223: 8 | C223: 20 | D223: Publication bi-mensuelle Honorée d'une souscription du Ministère de l'Instruction publique et des Beaux-Arts | E223: ML5.R35 | F223: 15 Octobre 1908 | G223: 541-564 | H223: 24 | I223: yes | J223: no
A224: La revue musicale | B224: 8 | C224: 21 | D224: Publication bi-mensuelle Honorée d'une souscription du Ministère de l'Instruction publique et des Beaux-Arts | E224: ML5.R35 | F224: 1er Novembre 1908 | G224: 565-588 | H224: 24 | I224: yes | J224: no
A225: La revue musicale | B225: 8 | C225: 22 | D225: Publication bi-mensuelle Honorée d'une souscription du Ministère de l'Instruction publique et des Beaux-Arts | E225: ML5.R35 | F225: 15 Novembre 1908 | G225: 589-612 | H225: 24 | I225: yes | J225: no
A226: La revue musicale | B226: 8 | C226: 23 | D226: Publication bi-mensuelle Honorée d'une souscription du Ministère de l'Instruction publique et des Beaux-Arts | E226: ML5.R35 | F226: 1er Décembre 1908 | G226: 613-648 | H226: 36 | I226: yes | J226: no
A227: La revue musicale | B227: 8 | C227: 24 | D227: Publication bi-mensuelle Honorée d'une souscription du Ministère de l'Instruction publique et des Beaux-Arts | E227: ML5.R35 | F227: 15 Décembre 1908 | G227: 649-672 | H227: 24 | I227: yes | J227: no
G228: TOTAL PAGE COUNT: | H228: =SUM(R[-22]C:R[-1]C) -> 647
A229: La revue musicale | B229: 9 | C229: 1 | D229: Publication bi-mensuelle Honorée d'une souscription du Ministère de l'Instruction publique et des Beaux-Arts | E229: ML5.R35 | F229: 1er Janvier 1909 | G229: [i-viii unpaginated ads/title pgs.] 1-36 | H229: 44 | I229: yes | J229: no
A230: La revue musicale | B230: 9 | C230: 2 | D230: Publication bi-mensuelle Honorée d'une souscription du Ministère de l'Instruction publique et des Beaux-Arts | E230: ML5.R35 | F230: 15 Janvier 1909 | G230: 37-60 | H230: 24 | I230: yes | J230: no | K230: index lacking
A231: La revue musicale | B231: 9 | C231: 3 | D231: Publication bi-mensuelle Honorée d'une souscription du Ministère de l'Instruction publique et des Beaux-Arts | E231: ML5.R35 | F231: 1er Février 1909 | G231: 61-96 | H231: 36 | I231: yes | J231: no
A232: La revue musicale | B232: 9 | C232: 4 | D232: Publication bi-mensuelle Honorée d'une souscription du Ministère de l'Instruction publique et des Beaux-Arts | E232: ML5.R35 | F232: 15 Février 1909 | G232: 97-128 | H232: 32 | I232: yes | J232: no
A233: La revue musicale | B233: 9 | C233: 5 | D233: Publication bi-mensuelle Honorée d'une souscription du Ministère de l'Instruction publique et des Beaux-Arts | E233: ML5.R35 | F233: 1er Mars 1909 | G233: 129-156 | H233: 28 | I233: yes | J233: no
A234: La revue musicale | B234: 9 | C234: 6 | D234: Publication bi-mensuelle Honorée d'une souscription du Ministère de l'Instruction publique et des Beaux-Arts | E234: ML5.R35 | F234: 15 Mars 1909 | G234: 157-180 | H234: 24 | I234: yes | J234: no
A235: La revue musicale | B235: 9 | C235: 7 | D235: Publication bi-mensuelle Honorée d'une souscription du Ministère de l'Instruction publique et des Beaux-Arts | E235: ML5.R35 | F235: 1er Avril 1909 | G235: 181-204 | H235: 24 | I235: yes | J235: no
A236: La revue musicale | B236: 9 | C236: 8 | D236: Publication bi-mensuelle Honorée d'une souscription du Ministère de l'Instruction publique et des Beaux-Arts | E236: ML5.R35 | F236: 15 Avril 1909 | G236: 205-236 | H236: 32 | I236: yes | J236: no
A237: La revue musicale | B237: 9 | C237: 9 | D237: Publication bi-mensuelle Honorée d'une souscription du Ministère de l'Instruction publique et des Beaux-Arts | E237: ML5.R35 | F237: 1er Mai 1909 | G237: 237-260 | H237: 24 | I237: yes | J237: no
A238: La revue musicale | B238: 9 | C238: 10 | D238: Publication bi-mensuelle Honorée d'une souscription du Ministère de l'Instruction publique et des Beaux-Arts | E238: ML5.R35 | F238: 15 Mai 1909 | G238: 261-284 | H238: 24 | I238: yes | J238: no
A239: La revue musicale | B239: 9 | C239: 11 | D239: Publication bi-mensuelle Honorée d'une souscription du Ministère de l'Instruction publique et des Beaux-Arts | E239: ML5.R35 | F239: 1er Juin 1909 | G239: 285-308 | H239: 24 | I239: yes | J239: no
A240: La revue musicale | B240: 9 | C240: 12 | D240: Publication bi-mensuelle Honorée d'une souscription du Ministère de l'Instruction publique et des Beaux-Arts | E240: ML5.R35 | F240: 15 Juin 1909 | G240: 309-332 | H240: 24 | I240: yes | J240: no
A241: La revue musicale | B241: 9 | C241: 13 | D241: Publication bi-mensuelle Honorée d'une souscription du Ministère de l'Instruction publique et des Beaux-Arts | E241: ML5.R35 | F241: 1er Juillet 1909 | G241: 333-364 | H241: 32 | I241: yes | J241: no
A242: La revue musicale | B242: 9 | C242: 14 | D242: Publication bi-mensuelle Honorée d'une souscription du Ministère de l'Instruction publique et des Beaux-Arts | E242: ML5.R35 | F242: 15 Juillet 1909 | G242: 365-388 | H242: 24 | I242: yes | J242: no
A243: La revue musicale | B243: 9 | C243: 15 | D243: Publication bi-mensuelle Honorée d'une souscription du Ministère de l'Instruction publique et des Beaux-Arts | E243: ML5.R35 | F243: 1er Août 1909 | G243: 389-412 | H243: 24 | I243: yes | J243: no
A244: La revue musicale | B244: 9 | C244: 16-17 | D244: Publication bi-mensuelle Honorée d'une souscription du Ministère de l'Instruction publique et des Beaux-Arts | E244: ML5.R35 | F244: 1er Septembre 1909 | G244: 413-444 | H244: 32 | I244: yes | J244: no
A245: La revue musicale | B245: 9 | C245: 18-19 | D245: Publication bi-mensuelle Honorée d'une souscription du Ministère de l'Instruction publique et des Beaux-Arts | E245: ML5.R35 | F245: 1er Octobre 1909 | G245: 445-468 | H245: 24 | I245: yes | J245: no
A246: La revue musicale | B246: 9 | C246: 20 | D246: Publication bi-mensuelle Honorée d'une souscription du Ministère de l'Instruction publique et des Beaux-Arts | E246: ML5.R35 | F246: 15 Octobre 1909 | G246: 449-484 | H246: 16 | I246: yes | J246: no
A247: La revue musicale | B247: 9 | C247: 21 | D247: Publication bi-mensuelle Honorée d'une souscription du Ministère de l'Instruction publique et des Beaux-Arts | E247: ML5.R35 | F247: 1er Novembre 1909 | G247: [cover] 485-500 | H247: 18 | I247: yes | J247: yes
A248: La revue musicale | B248: 9 | C248: 22 | D248: Publication bi-mensuelle Honorée d'une souscription du Ministère de l'Instruction publique et des Beaux-Arts | E248: ML5.R35 | F248: 15 Novembre 1909 | G248: [cover] 501-516 | H248: 18 | I248: yes | J248: yes
A249: La revue musicale | B249: 9 | C249: 23 | D249: Publication bi-mensuelle Honorée d'une souscription du Ministère de l'Instruction publique et des Beaux-Arts | E249: ML5.R35 | F249: 1er Décembre 1909 | G249: [cover] 517-532 | H249: 18 | I249: yes | J249: yes
A250: La revue musicale | B250: 9 | C250: 24 | D250: Publication bi-mensuelle Honorée d'une souscription du Ministère de l'Instruction publique et des Beaux-Arts | E250: ML5.R35 | F250: 15 Décembre 1909 | G250: [cover] 533-556 [back cover] | H250: 28 | I250: yes | J250: yes
G251: TOTAL PAGE COUNT: | H251: =SUM(R[-22]C:R[-1]C) -> 574
G252: TOTAL HOLDINGS: | H252: =SUM(R[-239]C,R[-226]C,R[-195]C,R[-151]C,R[-106]C,R[-70]C,R[-47]C,R[-24]C,R[-1]C) -> 5930